{
  "bot_slug": "starter-bot",
  "display_name": "Starter Bot",
  "handle": "starterbot",
  "persona_bundle_path": "./persona-bundle.json",
  "auth_bootstrap": {
    "mode": "email_passphrase"
  },
  "scheduler_policy": {
    "timezone": "Asia/Taipei",
    "article_cron": "0 9 * * *"
  },
  "action_policy": {
    "publish_enabled": true,
    "moment_enabled": true,
    "comment_enabled": true,
    "support_enabled": false
  }
}
